{
  "$schema": "http://json-schema.org/draft-07/schema#",
  "$id": "https://raw.githubusercontent.com/aryanmehrotra/ship-harness/main/schema/ship.config.schema.json",
  "title": "ship.config.json",
  "description": "Per-repo configuration for the ship-harness plugin.",
  "type": "object",
  "additionalProperties": false,
  "properties": {
    "$schema": { "type": "string" },
    "tracker": {
      "type": "object",
      "description": "Where ticket state lives. 'none' keeps it in .evidence/status.md.",
      "additionalProperties": true,
      "properties": {
        "kind": { "type": "string", "enum": ["github", "none"], "default": "none" }
      }
    },
    "testPaths": {
      "type": "array",
      "description": "Globs the phase guard freezes during the review and fix phases. Set these to match your ecosystem — the defaults only cover the common cases.",
      "items": { "type": "string" },
      "minItems": 1
    },
    "attribution": {
      "type": "boolean",
      "default": false,
      "description": "Whether generated PR bodies and status comments carry an AI-assistance footer."
    },
    "setup": {
      "type": "object",
      "description": "Written once the user has confirmed the loop budgets. The ship and review skills refuse to run until confirmedAt is set, because a budget nobody chose is a default nobody owns.",
      "additionalProperties": false,
      "properties": {
        "confirmedAt": { "type": ["string", "null"], "description": "ISO date the caps were confirmed. null means never confirmed." },
        "confirmedBy": { "type": "string" }
      }
    },
    "caps": {
      "type": "object",
      "description": "Loop budgets. You set these at init and confirm them before first use. 0 means no fixed cap: the loop runs until a round produces no new findings. A count is a blunt instrument — it stops a loop that is still making progress and lets one that is going in circles run to the limit — so the convergence rule is the real termination criterion either way.",
      "additionalProperties": false,
      "properties": {
        "research": { "type": "integer", "minimum": 0, "maximum": 10, "default": 3 },
        "reviewDelta": { "type": "integer", "minimum": 0, "maximum": 25, "default": 2 },
        "spikes": { "type": "integer", "minimum": 0, "maximum": 10, "default": 3 },
        "planReviewA": { "type": "integer", "minimum": 0, "maximum": 25, "default": 3 },
        "planReviewB": { "type": "integer", "minimum": 0, "maximum": 25, "default": 2 },
        "reviewA": { "type": "integer", "minimum": 0, "maximum": 25, "default": 3 },
        "reviewB": { "type": "integer", "minimum": 0, "maximum": 25, "default": 2 },
        "evidenceFix": { "type": "integer", "minimum": 0, "maximum": 10, "default": 2 }
      }
    },
    "reviewers": {
      "type": "object",
      "description": "Model tier per review round. Two different models is the point; collapsing them to one removes the independence the second round exists for.",
      "additionalProperties": false,
      "properties": {
        "correctness": { "type": "string", "default": "sonnet" },
        "design": { "type": "string", "default": "opus" }
      }
    },
    "memoryCaps": {
      "type": "object",
      "description": "Hard line caps on docs/memory. Adding is easy and removing takes judgement, so without a cap you get a file nobody trusts within two months.",
      "additionalProperties": false,
      "properties": {
        "map": { "type": "integer", "default": 100 },
        "patterns": { "type": "integer", "default": 60 },
        "decisions": { "type": "integer", "default": 40 },
        "scars": { "type": "integer", "default": 30 },
        "glossary": { "type": "integer", "default": 40 },
        "references": { "type": "integer", "default": 40 },
        "conventions": { "type": "integer", "default": 40 }
      }
    },
    "collectors": {
      "type": "array",
      "description": "Evidence collectors, run in order by scripts/collect.sh.",
      "minItems": 1,
      "items": {
        "type": "object",
        "required": ["name"],
        "additionalProperties": false,
        "properties": {
          "name": {
            "type": "string",
            "pattern": "^[a-z0-9][a-z0-9-]*$",
            "description": "Report goes to .evidence/<name>.json; baselines to .evidence/baseline/<name>/."
          },
          "kind": {
            "type": "string",
            "description": "A bundled collector.",
            "enum": ["builtin:web-shots", "builtin:http-pairs", "builtin:cmd-golden", "builtin:tests"]
          },
          "cmd": {
            "type": "string",
            "description": "Any executable obeying collectors/CONTRACT.md. Mutually exclusive with 'kind'."
          },
          "config": {
            "type": "object",
            "description": "Passed to the collector verbatim as the SHIP_COLLECTOR_CONFIG environment variable.",
            "additionalProperties": true
          }
        },
        "oneOf": [{ "required": ["kind"] }, { "required": ["cmd"] }]
      }
    }
  },
  "required": ["collectors"]
}
